{
	"Name": "SecondWind",
	"Stage": 1,
	"Type": "Simulation",
	"Abilities": [
		{
			"Name": "Second Wind 1 - Ability",
			"ActivationTrigger": {
				"TriggerType": "EveryXTime",
				"ActivateEveryTimeMs": 20000,
				"MaxActivations": 1
			},
			"TotalDurationMs": 0,
			"Skills": [
				{
					"Name": "Second Wind 1 - Heal",
					"Deployment": {
						"Type": "Direct"
					},
					"Targeting": {
						"Type": "Allegiance",
						"Guidance": [
							"Ground",
							"Underground",
							"Airborne"
						],
						"Group": "Ally"
					},
					"EffectPackage": {
						"Effects": [
							{
								"Type": "InstantHeal",
								"HealType": "Normal",
								"Expression": {
									"Percentage": 25,
									"Stat": "MaxHealth",
									"StatSource": "Receiver"
								}
							}
						]
					}
				}
			]
		}
	],
	"DisplayName": "Second Wind I",
	"DisplayDescription": "20 seconds into the battle, your team heals for 25% of their Max Health.",
	"Description": {
		"Format": "{TriggerTime} seconds into the battle, your team heals for {HealValue}% of their Max Health.",
		"Parameters": {
			"TriggerTime": {
				"ParameterPath": "Abilities[0].ActivationTrigger.ActivateEveryTimeMs",
				"ValueMultiplier": 0.001
			},
			"HealValue": {
				"ParameterPath": "Abilities[0].Skills[0].EffectPackage.Effects[0].Expression.Percentage"
			}
		}
	},
	"RuntimeBonus": {
		"GrantedAugments": [],
		"GrantedCredits": 0
	}
}