{
	"Name": "ChampionsFocus",
	"Stage": 2,
	"Type": "Simulation",
	"Abilities": [
		{
			"Name": "Champion's Focus 2 - Ability",
			"ActivationTrigger": {
				"TriggerType": "OnBattleStart"
			},
			"TotalDurationMs": 0,
			"Skills": [
				{
					"Name": "Champion's Focus 2 - Skill",
					"Deployment": {
						"Type": "Direct",
						"Guidance": [
							"Ground",
							"Underground",
							"Airborne"
						]
					},
					"Targeting": {
						"Type": "Tier",
						"Guidance": [
							"Ground",
							"Underground",
							"Airborne"
						],
						"Group": "Ally",
						"Tier": 5,
						"Num": 1
					},
					"EffectPackage": {
						"Effects": [
							{
								"Type": "Buff",
								"Stat": "AttackSpeed",
								"OverlapProcessType": "Stacking",
								"DurationMs": -1,
								"Expression": {
									"Percentage": 50,
									"Stat": "AttackSpeed",
									"StatSource": "Receiver",
									"StatEvaluationType": "Base"
								}
							},
							{
								"Type": "Buff",
								"Stat": "OmegaPowerPercentage",
								"OverlapProcessType": "Stacking",
								"DurationMs": -1,
								"Expression": 50
							}
						]
					}
				}
			]
		}
	],
	"DisplayName": "Champion's Focus II",
	"DisplayDescription": "A random Tier 5 Unit gains 50% Attack Speed and 50 Omega Power",
	"Description": {
		"Format": "A random Tier 5 Unit gains {ASVal}% Attack Speed and {OPVal} Omega Power",
		"Parameters": {
			"ASVal": {
				"ParameterPath": "Abilities[0].Skills[0].EffectPackage.Effects[0].Expression.Percentage"
			},
			"OPVal": {
				"ParameterPath": "Abilities[0].Skills[0].EffectPackage.Effects[1].Expression"
			}
		}
	},
	"RuntimeBonus": {
		"GrantedAugments": [],
		"GrantedCredits": 0
	}
}