{
	"Name": "ZeroTierOverdrive",
	"Stage": 2,
	"Type": "Simulation",
	"Abilities": [
		{
			"Name": "Zero-Tier Overdrive 2 - Ability",
			"ActivationTrigger": {
				"TriggerType": "OnBattleStart"
			},
			"TotalDurationMs": 0,
			"Skills": [
				{
					"Name": "Zero-Tier Overdrive 2 - Skill",
					"Deployment": {
						"Type": "Direct",
						"Guidance": [
							"Ground",
							"Underground",
							"Airborne"
						]
					},
					"Targeting": {
						"Type": "Tier",
						"Guidance": [
							"Ground",
							"Underground",
							"Airborne"
						],
						"Group": "Ally",
						"Tier": 0
					},
					"EffectPackage": {
						"Effects": [
							{
								"Type": "Buff",
								"Stat": "VulnerabilityPercentage",
								"OverlapProcessType": "Stacking",
								"DurationMs": -1,
								"Expression": 16
							},
							{
								"Type": "Buff",
								"Stat": "AttackPhysicalDamage",
								"OverlapProcessType": "Stacking",
								"DurationMs": -1,
								"Expression": {
									"Percentage": 16,
									"Stat": "AttackPhysicalDamage",
									"StatSource": "Receiver"
								}
							},
							{
								"Type": "Buff",
								"Stat": "AttackEnergyDamage",
								"OverlapProcessType": "Stacking",
								"DurationMs": -1,
								"Expression": {
									"Percentage": 16,
									"Stat": "AttackEnergyDamage",
									"StatSource": "Receiver"
								}
							},
							{
								"Type": "Buff",
								"Stat": "AttackPureDamage",
								"OverlapProcessType": "Stacking",
								"DurationMs": -1,
								"Expression": {
									"Percentage": 16,
									"Stat": "AttackPureDamage",
									"StatSource": "Receiver"
								}
							},
							{
								"Type": "Buff",
								"Stat": "OmegaDamagePercentage",
								"OverlapProcessType": "Stacking",
								"DurationMs": -1,
								"Expression": {
									"Percentage": 16,
									"Stat": "OmegaDamagePercentage",
									"StatSource": "Receiver"
								}
							}
						]
					}
				}
			]
		}
	],
	"DisplayName": "Zero-Tier Overdrive II",
	"DisplayDescription": "Your Tier 0 units deal 16% more and receive 16% less damage.",
	"Description": {
		"Format": "Your Tier 0 units deal {DmgAmpVal}% more and receive {DmgRedVal}% less damage.",
		"Parameters": {
			"DmgRedVal": {
				"ParameterPath": "Abilities[0].Skills[0].EffectPackage.Effects[0].Expression"
			},
			"DmgAmpVal": {
				"ParameterPath": "Abilities[0].Skills[0].EffectPackage.Effects[4].Expression.Percentage"
			}
		}
	},
	"RuntimeBonus": {
		"GrantedAugments": [],
		"GrantedCredits": 0
	}
}