{
	"Name": "Dust",
	"Stage": 2,
	"Type": "Game",
	"DisplayName": "Dust Module",
	"DisplayDescription": "Gain a Dust Imprint.",
	"Description": {
		"Format": "Gain a Dust Imprint.",
		"Parameters": {}
	},
	"RuntimeBonus": {
		"GrantedAugments": [
			{
				"Name": "Dust",
				"Stage": 0,
				"Variation": "Original"
			}
		],
		"GrantedCredits": 0
	}
}