{
	"Name": "WindborneWard",
	"Stage": 2,
	"Type": "Simulation",
	"Abilities": [
		{
			"Name": "WindborneWard2_Ability1",
			"ActivationTrigger": {
				"TriggerType": "OnBattleStart"
			},
			"TotalDurationMs": 0,
			"Skills": [
				{
					"Name": "WindborneWard2 - Targeting",
					"Deployment": {
						"Type": "Direct",
						"Guidance": [
							"Ground",
							"Airborne",
							"Underground"
						]
					},
					"Targeting": {
						"Type": "Allegiance",
						"Group": "Ally",
						"Guidance": [
							"Ground",
							"Airborne",
							"Underground"
						]
					},
					"EffectPackage": {
						"Effects": [
							{
								"Type": "SpawnMark",
								"MarkType": "Beneficial",
								"DurationMs": -1,
								"AttachedAbilities": [
									{
										"Name": "WindborneWard2 - Sub Ability",
										"ActivationTrigger": {
											"TriggerType": "OnActivateXAbilities",
											"AbilityTypes": [
												"Omega"
											],
											"EveryX": true,
											"NumberOfAbilitiesActivated": 1
										},
										"TotalDurationMs": 0,
										"Skills": [
											{
												"Name": "WindborneWard2 - Burn Energy",
												"Targeting": {
													"Type": "DistanceCheck",
													"Guidance": [
														"Ground",
														"Underground",
														"Airborne"
													],
													"Group": "Enemy",
													"Lowest": true,
													"Num": 1
												},
												"Deployment": {
													"Type": "Direct",
													"Guidance": [
														"Ground",
														"Underground",
														"Airborne"
													]
												},
												"EffectPackage": {
													"Effects": [
														{
															"Type": "InstantEnergyBurn",
															"Expression": 24000
														}
													]
												}
											}
										]
									}
								]
							}
						]
					}
				}
			]
		}
	],
	"DisplayName": "Windborne Ward II",
	"DisplayDescription": "When your units use the Omega, they burn 24 energy from their closest enemy.",
	"Description": {
		"Format": "When your units use the Omega, they burn {EnergyVal} energy from their closest enemy.",
		"Parameters": {
			"EnergyVal": {
				"ParameterPath": "Abilities[0].Skills[0].EffectPackage.Effects[0].AttachedAbilities[0].Skills[0].EffectPackage.Effects[0].Expression",
				"ValueMultiplier": 0.001
			}
		}
	},
	"RuntimeBonus": {
		"GrantedAugments": [],
		"GrantedCredits": 0
	}
}