{
	"Name": "Wildfire",
	"Stage": 2,
	"Type": "Game",
	"DisplayName": "Wildfire Module",
	"DisplayDescription": "Gain a Wildfire Imprint.",
	"Description": {
		"Format": "Gain a Wildfire Imprint.",
		"Parameters": {}
	},
	"RuntimeBonus": {
		"GrantedAugments": [
			{
				"Name": "Wildfire",
				"Stage": 0,
				"Variation": "Original"
			}
		],
		"GrantedCredits": 0
	}
}