{
	"Name": "Predator",
	"Stage": 3,
	"Type": "Game",
	"DisplayName": "Predator Matrix",
	"DisplayDescription": "Gain a Predator Imprint and an Overguard.",
	"Description": {
		"Format": "Gain a Predator Imprint and an Overguard.",
		"Parameters": {}
	},
	"RuntimeBonus": {
		"GrantedAugments": [
			{
				"Name": "Predator",
				"Stage": 0,
				"Variation": "Original"
			},
			{
				"Name": "UmbralStride",
				"Stage": 0,
				"Variation": "Original"
			}
		],
		"GrantedCredits": 0
	}
}