{
	"Name": "LightningSpeed",
	"Stage": 3,
	"Type": "Simulation",
	"Abilities": [
		{
			"Name": "All allied units Move and Attack 50% Faster",
			"ActivationTrigger": {
				"TriggerType": "OnBattleStart"
			},
			"TotalDurationMs": 0,
			"Skills": [
				{
					"Name": "All allied units Move and Attack 50% Faster",
					"Deployment": {
						"Type": "Direct"
					},
					"Targeting": {
						"Type": "Allegiance",
						"Guidance": [
							"Ground",
							"Underground",
							"Airborne"
						],
						"Group": "Ally"
					},
					"EffectPackage": {
						"Effects": [
							{
								"Type": "Buff",
								"Stat": "AttackSpeed",
								"OverlapProcessType": "Stacking",
								"DurationMs": -1,
								"Expression": {
									"Percentage": 25,
									"Stat": "AttackSpeed",
									"StatSource": "Receiver",
									"StatEvaluationType": "Base"
								}
							},
							{
								"Type": "Buff",
								"Stat": "MoveSpeedSubUnits",
								"OverlapProcessType": "Stacking",
								"DurationMs": -1,
								"Expression": {
									"Percentage": 25,
									"Stat": "MoveSpeedSubUnits",
									"StatSource": "Receiver",
									"StatEvaluationType": "Base"
								}
							}
						]
					}
				}
			]
		}
	],
	"DisplayName": "Lightning Speed III",
	"DisplayDescription": "All allied units Move and Attack 25% Faster",
	"Description": {
		"Format": "All allied units Move and Attack {ASMSVal}% Faster",
		"Parameters": {
			"ASMSVal": {
				"ParameterPath": "Abilities[0].Skills[0].EffectPackage.Effects[0].Expression.Percentage"
			}
		}
	},
	"RuntimeBonus": {
		"GrantedAugments": [],
		"GrantedCredits": 0
	}
}