{
	"Name": "Tsunami",
	"Stage": 3,
	"Type": "Game",
	"DisplayName": "Tsunami Matrix",
	"DisplayDescription": "Gain a Tsunami Imprint and a Mindstorm.",
	"Description": {
		"Format": "Gain a Tsunami Imprint and a Mindstorm.",
		"Parameters": {}
	},
	"RuntimeBonus": {
		"GrantedAugments": [
			{
				"Name": "Tsunami",
				"Stage": 0,
				"Variation": "Original"
			},
			{
				"Name": "Mindstorm",
				"Stage": 0,
				"Variation": "Original"
			}
		],
		"GrantedCredits": 0
	}
}